{
  "bridge_name": "qubit",
  "version": "1.0",
  "nodes": [
    {
      "node_id": "MockToken",
      "node_type": "contract",
      "chain": "destination",
      "address": "",
      "functions": []
    },
    {
      "node_id": "User",
      "node_type": "actor",
      "chain": "offchain",
      "address": "",
      "functions": []
    },
    {
      "node_id": "QBridgeBSC",
      "node_type": "router",
      "chain": "destination",
      "address": "",
      "functions": []
    },
    {
      "node_id": "OffchainRelay",
      "node_type": "relay",
      "chain": "offchain",
      "address": "",
      "functions": []
    },
    {
      "node_id": "QBridgeETH",
      "node_type": "router",
      "chain": "source",
      "address": "",
      "functions": []
    }
  ],
  "edges": [
    {
      "edge_id": "e1",
      "src": "MockToken",
      "dst": "User",
      "label": "mint",
      "token": "MockToken",
      "conditions": [],
      "condition_objects": [],
      "function_signature": "mint(address,uint256)"
    },
    {
      "edge_id": "e2",
      "src": "MockToken",
      "dst": "User",
      "label": "mint",
      "token": "xQubit",
      "conditions": [
        "require(!processed[nonce_])"
      ],
      "condition_objects": [
        {
          "type": "nonce",
          "params": {
            "expression": "require(!processed[nonce_])"
          }
        }
      ],
      "function_signature": "process(address,uint256,uint64)"
    },
    {
      "edge_id": "e3",
      "src": "User",
      "dst": "QBridgeETH",
      "label": "lock",
      "token": "0x0000000000000000000000000000000000000000",
      "conditions": [],
      "condition_objects": [],
      "function_signature": "deposit(address,uint256,address)"
    }
  ],
  "invariants": [
    {
      "invariant_id": "asset_conservation_total_mint_equals_locked",
      "category": "asset_conservation",
      "description": "The total amount of xQubit minted via edge e2 must equal the total amount locked via edge e3 minus accumulated fees.",
      "predicate": "totalMinted == totalLocked - (totalLocked * feeRate / 10000)",
      "solidity_assertion": "assert(totalMinted == totalLocked - (totalLocked * feeRate / 10000));",
      "related_edges": [
        "e2",
        "e3"
      ]
    },
    {
      "invariant_id": "asset_conservation_user_balance_monotonic",
      "category": "asset_conservation",
      "description": "A user's MockToken balance after a mint (edge e1 or e2) cannot be less than before the mint.",
      "predicate": "balanceAfter[user] >= balanceBefore[user]",
      "solidity_assertion": "assert(balanceAfter[user] >= balanceBefore[user]);",
      "related_edges": [
        "e1",
        "e2"
      ]
    },
    {
      "invariant_id": "asset_conservation_no_overmint",
      "category": "asset_conservation",
      "description": "The sum of all minted MockToken amounts must never exceed the sum of locked native tokens across all deposits.",
      "predicate": "totalMinted <= totalLocked",
      "solidity_assertion": "assert(totalMinted <= totalLocked);",
      "related_edges": [
        "e1",
        "e2",
        "e3"
      ]
    },
    {
      "invariant_id": "authorization_mint_only_by_router",
      "category": "authorization",
      "description": "Mint functions on MockToken (edge e1) can only be called by the destination router QBridgeBSC.",
      "predicate": "msg.sender == routerBSC",
      "solidity_assertion": "require(msg.sender == routerBSC, \"Only router can mint\");",
      "related_edges": [
        "e1"
      ]
    },
    {
      "invariant_id": "authorization_lock_only_by_user",
      "category": "authorization",
      "description": "Lock (deposit) function (edge e3) can only be invoked by an externally owned account representing a user.",
      "predicate": "msg.sender == tx.origin && isUser[msg.sender]",
      "solidity_assertion": "require(msg.sender == tx.origin && isUser[msg.sender], \"Only user can lock\");",
      "related_edges": [
        "e3"
      ]
    },
    {
      "invariant_id": "authorization_process_requires_unprocessed_nonce",
      "category": "authorization",
      "description": "The process function (edge e2) must reject a nonce that has already been marked processed.",
      "predicate": "!processed[nonce]",
      "solidity_assertion": "require(!processed[nonce], \"Nonce already processed\");",
      "related_edges": [
        "e2"
      ]
    },
    {
      "invariant_id": "authorization_process_requires_valid_signature",
      "category": "authorization",
      "description": "The process call must verify the off‑chain relay signature over (user, amount, nonce).",
      "predicate": "verifySignature(sig, keccak256(abi.encodePacked(user, amount, nonce))) == true",
      "solidity_assertion": "require(verifySignature(sig, keccak256(abi.encodePacked(user, amount, nonce))), \"Invalid relay signature\");",
      "related_edges": [
        "e2"
      ]
    },
    {
      "invariant_id": "uniqueness_nonce_processed_once",
      "category": "uniqueness",
      "description": "A nonce can be processed only once; after processing it is marked and cannot be processed again.",
      "predicate": "processedCount[nonce] == 0",
      "solidity_assertion": "require(processedCount[nonce] == 0, \"Nonce already used\"); processedCount[nonce] = 1;",
      "related_edges": [
        "e2"
      ]
    },
    {
      "invariant_id": "uniqueness_deposit_id_unique",
      "category": "uniqueness",
      "description": "Each deposit creates a unique depositId derived from (user, amount, nonce) that must not have been seen before.",
      "predicate": "!depositSeen[depositId]",
      "solidity_assertion": "require(!depositSeen[depositId], \"Deposit already recorded\"); depositSeen[depositId] = true;",
      "related_edges": [
        "e3"
      ]
    },
    {
      "invariant_id": "uniqueness_no_replay_of_processed_nonce",
      "category": "uniqueness",
      "description": "A processed nonce cannot be used to trigger a refund after it has been minted.",
      "predicate": "processed[nonce] => !refundRequested[nonce]",
      "solidity_assertion": "if (processed[nonce]) { assert(!refundRequested[nonce]); }",
      "related_edges": [
        "e2",
        "e3"
      ]
    },
    {
      "invariant_id": "timeliness_refund_allowed_after_timeout",
      "category": "timeliness",
      "description": "A user may call refund for a deposit only after the lock timestamp plus the configured timeout has elapsed.",
      "predicate": "block.timestamp >= lockTimestamp[depositId] + timeout",
      "solidity_assertion": "require(block.timestamp >= lockTimestamp[depositId] + timeout, \"Timeout not reached\");",
      "related_edges": [
        "e3"
      ]
    },
    {
      "invariant_id": "timeliness_process_before_timeout",
      "category": "timeliness",
      "description": "The process (mint) must occur before the corresponding lock timeout expires.",
      "predicate": "block.timestamp < lockTimestamp[depositId] + timeout",
      "solidity_assertion": "require(block.timestamp < lockTimestamp[depositId] + timeout, \"Processing after timeout\");",
      "related_edges": [
        "e2",
        "e3"
      ]
    },
    {
      "invariant_id": "timeliness_refund_clears_processed",
      "category": "timeliness",
      "description": "After a successful refund, the processed flag for the nonce must be cleared to prevent later minting.",
      "predicate": "refundExecuted[nonce] => processed[nonce] == false",
      "solidity_assertion": "if (refundExecuted[nonce]) { assert(!processed[nonce]); }",
      "related_edges": [
        "e3"
      ]
    },
    {
      "invariant_id": "timeliness_timeout_positive",
      "category": "timeliness",
      "description": "The timeout value configured in the bridge must be a positive non‑zero number.",
      "predicate": "timeout > 0",
      "solidity_assertion": "require(timeout > 0, \"Timeout must be >0\");",
      "related_edges": []
    },
    {
      "invariant_id": "timeliness_global_pause_prevents_lock",
      "category": "timeliness",
      "description": "When the bridge is globally paused, new lock operations (edge e3) are rejected.",
      "predicate": "!paused",
      "solidity_assertion": "require(!paused, \"Bridge is paused\");",
      "related_edges": [
        "e3"
      ]
    },
    {
      "invariant_id": "asset_conservation_fee_deduction",
      "category": "asset_conservation",
      "description": "The fee taken from each locked amount is correctly accounted in the totalFees variable.",
      "predicate": "totalFees == accumulatedFees",
      "solidity_assertion": "assert(totalFees == accumulatedFees);",
      "related_edges": [
        "e3",
        "e2"
      ]
    },
    {
      "invariant_id": "authorization_mint_amount_matches_locked",
      "category": "authorization",
      "description": "The amount minted in edge e2 must equal the locked amount for the same nonce minus the fee.",
      "predicate": "mintedAmount == lockedAmount[nonce] - (lockedAmount[nonce] * feeRate / 10000)",
      "solidity_assertion": "require(mintedAmount == lockedAmount[nonce] - (lockedAmount[nonce] * feeRate / 10000), \"Mint amount mismatch\");",
      "related_edges": [
        "e2",
        "e3"
      ]
    },
    {
      "invariant_id": "timeliness_lock_timestamp_recorded",
      "category": "timeliness",
      "description": "When a lock (edge e3) is executed, the current block timestamp is stored in lockTimestamp for that depositId.",
      "predicate": "lockTimestamp[depositId] == block.timestamp at execution",
      "solidity_assertion": "require(lockTimestamp[depositId] == block.timestamp, \"Timestamp not recorded\");",
      "related_edges": [
        "e3"
      ]
    }
  ]
}