{
  "bridge_name": "qubit",
  "version": "1.0",
  "nodes": [
    {
      "node_id": "User",
      "node_type": "user",
      "chain": "source",
      "address": "",
      "functions": []
    },
    {
      "node_id": "mocktoken",
      "node_type": "contract",
      "chain": "source",
      "address": "",
      "functions": []
    },
    {
      "node_id": "qbridgebsc",
      "node_type": "contract",
      "chain": "source",
      "address": "",
      "functions": []
    },
    {
      "node_id": "is",
      "node_type": "contract",
      "chain": "source",
      "address": "",
      "functions": []
    },
    {
      "node_id": "relay",
      "node_type": "relay",
      "chain": "offchain",
      "address": "",
      "functions": []
    },
    {
      "node_id": "qbridgeeth",
      "node_type": "contract",
      "chain": "source",
      "address": "",
      "functions": []
    },
    {
      "node_id": "bridge",
      "node_type": "contract",
      "chain": "source",
      "address": "",
      "functions": []
    }
  ],
  "edges": [
    {
      "edge_id": "e1",
      "src": "bridge",
      "dst": "User",
      "label": "unlock",
      "token": "UNKNOWN",
      "conditions": [],
      "condition_objects": [],
      "function_signature": ""
    },
    {
      "edge_id": "e2",
      "src": "relay",
      "dst": "bridge",
      "label": "verify",
      "token": "UNKNOWN",
      "conditions": [],
      "condition_objects": [],
      "function_signature": "process(address recipient,uint256 amount,uint64 nonce_)"
    },
    {
      "edge_id": "e3",
      "src": "User",
      "dst": "bridge",
      "label": "lock",
      "token": "UNKNOWN",
      "conditions": [],
      "condition_objects": [],
      "function_signature": "deposit(address token,uint256 amount,address recipient)"
    }
  ],
  "invariants": [
    {
      "invariant_id": "inv_asset_conservation",
      "category": "asset_conservation",
      "description": "Locked value (minus fee) should match minted/unlocked value.",
      "predicate": "sum(locked) - fee == sum(minted_or_unlocked)",
      "solidity_assertion": "assert(totalLocked() >= totalMinted() + totalUnlocked());",
      "related_edges": [
        "e1",
        "e2",
        "e3"
      ]
    },
    {
      "invariant_id": "inv_authorization",
      "category": "authorization",
      "description": "Mint/unlock requires valid prior source-chain lock and proof verification.",
      "predicate": "mint_or_unlock -> exists(valid_lock && verified_message)",
      "solidity_assertion": "require(isVerified(messageHash) && lockExists(nonce), 'unauthorized mint/unlock');",
      "related_edges": [
        "e1",
        "e2",
        "e3"
      ]
    },
    {
      "invariant_id": "inv_uniqueness",
      "category": "uniqueness",
      "description": "Each deposit/nonce can be consumed at most once.",
      "predicate": "processed[nonce] == false before consume",
      "solidity_assertion": "require(!processed[nonce], 'replay');",
      "related_edges": [
        "e1",
        "e2",
        "e3"
      ]
    },
    {
      "invariant_id": "inv_timeliness",
      "category": "timeliness",
      "description": "Locked assets become refundable after timeout if destination action not finalized.",
      "predicate": "expired(timeout) && !finalized -> refundable",
      "solidity_assertion": "require(block.timestamp >= lockTime + timeout, 'too early');",
      "related_edges": [
        "e1",
        "e2",
        "e3"
      ]
    }
  ]
}